country_code,date,likes,place_full_name,place_name,place_type,retweets,text,verified,Sentiment Label,city,state_id,state_name,county_name,lat,lng,round_date
US,2021-05-14 04:09:15,0.0,"Oakland, CA",Oakland,city,0.0,you are absolutely right could you please correct me and post links for studies that ha,0.0,1,Oakland,CA,California,Alameda,37.7903,-122.2165,2021-05-14 04:00:00
US,2021-05-14 04:09:00,0.0,"Oakland, CA",Oakland,city,0.0,you are absolutely right could you please correct me and post links for studies that h,0.0,1,Oakland,CA,California,Alameda,37.7903,-122.2165,2021-05-14 04:00:00
US,2021-05-14 04:08:50,0.0,"Oakland, CA",Oakland,city,0.0,you are absolutely right could you please correct me and post links for studies th,0.0,1,Oakland,CA,California,Alameda,37.7903,-122.2165,2021-05-14 04:00:00
US,2021-05-14 04:08:27,0.0,"Waxahachie, TX",Waxahachie,city,0.0,they better fuck the right off with vaccine passports,0.0,0,Waxahachie,TX,Texas,Ellis,32.4032,-96.8444,2021-05-14 04:00:00
US,2021-05-14 04:07:24,0.0,"Plainfield, IN",Plainfield,city,0.0,ah see recommendations as well as vaccines have always been voluntary never got the flu vaccine until was 20,0.0,1,Plainfield,IN,Indiana,Hendricks,39.6953,-86.3717,2021-05-14 04:00:00
US,2021-05-14 04:06:41,0.0,"Nashville, TN",Nashville,city,0.0,covid is revealing the type of person we really are sigh,0.0,1,Nashville,TN,Tennessee,Davidson,36.1715,-86.7843,2021-05-14 04:00:00
US,2021-05-14 04:06:16,7.0,"Los Angeles, CA",Los Angeles,city,1.0,but only worse cause in the analogy you just be sacrificing keeping yourself dry but with the vaccine you be p,0.0,0,Los Angeles,CA,California,Los Angeles,34.1139,-118.4068,2021-05-14 04:00:00
US,2021-05-14 04:05:07,8.0,"Wilkinsburg, PA",Wilkinsburg,city,0.0,continuing to wear mask is good continuing to spread the idea that having the vaccine does little to nothing to,0.0,1,Wilkinsburg,PA,Pennsylvania,Allegheny,40.4442,-79.8733,2021-05-14 04:00:00
US,2021-05-14 04:04:47,1.0,"El Paso, TX",El Paso,city,1.0,my clinic is giving out moderna vaccines if anyone needs it still please hmu,0.0,1,El Paso,TX,Texas,El Paso,31.8479,-106.4309,2021-05-14 04:00:00
US,2021-05-14 04:03:41,9.0,"Wilkinsburg, PA",Wilkinsburg,city,0.0,whispers the point of getting the vaccine is because it lowers your risk of getting covid and makes hospitalizati,0.0,0,Wilkinsburg,PA,Pennsylvania,Allegheny,40.4442,-79.8733,2021-05-14 04:00:00
US,2021-05-14 04:03:05,0.0,"Clifton, AZ",Clifton,city,0.0,no completely understand for our area moderna was the only one available bit since my sister is under,0.0,0,Clifton,AZ,Arizona,Greenlee,33.0249,-109.2883,2021-05-14 04:00:00
US,2021-05-14 04:02:43,0.0,"Wisconsin Rapids, WI",Wisconsin Rapids,city,0.0,that would be 100 violation of someone rights if someone does not want the vacci,0.0,0,Wisconsin Rapids,WI,Wisconsin,Wood,44.3927,-89.8265,2021-05-14 04:00:00
US,2021-05-14 04:01:43,33.0,"Boulder, CO",Boulder,city,0.0,my kid got the vaccine today no side affects had none either btw,0.0,0,Boulder,CO,Colorado,Boulder,40.0249,-105.2523,2021-05-14 04:00:00
US,2021-05-14 04:01:41,0.0,"Washington, DC",Washington,city,0.0,a thing that confuses me is people saying like when m vaccinated im going to fuck everything don know be,0.0,0,Washington,DC,District of Columbia,District of Columbia,38.9047,-77.0163,2021-05-14 04:00:00
US,2021-05-14 04:01:28,0.0,"Stillwater, OK",Stillwater,city,0.0,you can sue them this is more misinformation,0.0,0,Stillwater,OK,Oklahoma,Payne,36.1316,-97.074,2021-05-14 04:00:00
US,2021-05-14 04:01:14,3.0,"Montevallo, AL",Montevallo,city,0.0,i ve been fully vaccinated for about 6 weeks now beginning to think covid is not why everyone avoids me,0.0,1,Montevallo,AL,Alabama,Shelby,33.1246,-86.8476,2021-05-14 04:00:00
US,2021-05-14 04:01:08,8.0,"Pasadena, CA",Pasadena,city,0.0,i fully vaccinated my workplace is fully vaccinated we re tested twice week for covid and fully 80,0.0,1,Pasadena,CA,California,Los Angeles,34.1597,-118.139,2021-05-14 04:00:00
US,2021-05-14 04:00:44,1.0,"Houston, TX",Houston,city,0.0,hang on bill maher and many others was fully vaccinated but he still contracted covid can you please e,0.0,1,Houston,TX,Texas,Harris,29.7863,-95.3889,2021-05-14 04:00:00
US,2021-05-14 04:00:42,0.0,"Troy, MI",Troy,city,0.0,we have anti maskers and we have vaccine that everyone is scared to get we also have the cdc that cant be truste,0.0,0,Troy,MI,Michigan,Oakland,42.5818,-83.1457,2021-05-14 04:00:00
US,2021-05-14 04:00:18,3.0,"Irving, TX",Irving,city,0.0,if he needs vaccine for covid then think how dangerous the covid is stay home stay safe,0.0,0,Irving,TX,Texas,Dallas,32.8584,-96.9702,2021-05-14 04:00:00
US,2021-05-14 04:00:06,4.0,"Lake Morton-Berrydale, WA",Lake Morton-Berrydale,city,0.0,i don think you ve read your own link it confirms one can still get c19,0.0,1,Lake Morton-Berrydale,WA,Washington,King,47.3325,-122.1032,2021-05-14 04:00:00
US,2021-05-14 03:58:34,2.0,"San Diego, CA",San Diego,city,0.0,booked the big post covid family vacation thanks,1.0,1,San Diego,CA,California,San Diego,32.8312,-117.1225,2021-05-14 03:00:00
US,2021-05-14 03:58:15,14.0,"Huntington Beach, CA",Huntington Beach,city,0.0,it amazing to me that sitting us president is forcing an experimental vaccine on its citizens,0.0,1,Huntington Beach,CA,California,Orange,33.696,-118.0025,2021-05-14 03:00:00
US,2021-05-14 03:58:13,1.0,"Lauderhill, FL",Lauderhill,city,1.0,aw bad fan vibes,0.0,0,Lauderhill,FL,Florida,Broward,26.1605,-80.2242,2021-05-14 03:00:00
US,2021-05-14 03:57:57,3.0,"Sinton, TX",Sinton,city,0.0,serious question if you haven caught corona during the whole pandemic thing would get the vaccine,0.0,0,Sinton,TX,Texas,San Patricio,28.0392,-97.5154,2021-05-14 03:00:00
US,2021-05-14 03:57:08,1.0,"Eugene, OR",Eugene,city,0.0,for the love of god wear your damn masks the alternative has pirate quivering in my boots,0.0,1,Eugene,OR,Oregon,Lane,44.0563,-123.1173,2021-05-14 03:00:00
US,2021-05-14 03:56:53,1.0,"Portales, NM",Portales,city,0.0,reezy d tell you to play nice but hey also did not and will not get the vaccin,0.0,1,Portales,NM,New Mexico,Roosevelt,34.1753,-103.3565,2021-05-14 03:00:00
US,2021-05-14 03:56:43,0.0,"Miami Beach, FL",Miami Beach,city,0.0,we have to make sure the bishop is also getting calls from catholics and other christians who are appalled by altma,0.0,0,Miami Beach,FL,Florida,Miami-Dade,25.8171,-80.1396,2021-05-14 03:00:00
US,2021-05-14 03:56:38,0.0,"Miami Beach, FL",Miami Beach,city,0.0,after fr james altman repeatedly used his pulpit to downplay covid 19 spread deadly conspiracy theories about mas,0.0,0,Miami Beach,FL,Florida,Miami-Dade,25.8171,-80.1396,2021-05-14 03:00:00
US,2021-05-14 03:56:35,3.0,"Corpus Christi, TX",Corpus Christi,city,0.0,my mom asked me to set up covid vaccines for her and taurino out of the blue and was like bet,0.0,1,Corpus Christi,TX,Texas,Nueces,27.726,-97.3755,2021-05-14 03:00:00
US,2021-05-14 03:56:07,1.0,"Los Angeles, CA",Los Angeles,city,0.0,thinking of the 600 000 americans who died from covid and don get to this day where masks are not needed if you r,0.0,0,Los Angeles,CA,California,Los Angeles,34.1139,-118.4068,2021-05-14 03:00:00
US,2021-05-14 03:56:02,16.0,"Lemoore, CA",Lemoore,city,0.0,enjoy wearing one your whole life then since it existed before this and will exist our entire lifetime,0.0,1,Lemoore,CA,California,Kings,36.2949,-119.7983,2021-05-14 03:00:00
US,2021-05-14 03:54:50,1.0,"Washington, NJ",Washington,city,0.0,eu confident of covid 19 travel certificate for summer,0.0,1,Washington,NJ,New Jersey,Warren,40.7587,-74.9825,2021-05-14 03:00:00
US,2021-05-14 03:53:54,1.0,"Tarrytown, NY",Tarrytown,city,0.0,to be clear the cdc doesn understand basic science and m not talking about anything covid mask,0.0,1,Tarrytown,NY,New York,Westchester,41.0647,-73.8673,2021-05-14 03:00:00
US,2021-05-14 03:53:39,0.0,"Henderson, NV",Henderson,city,0.0,thought you might be interested in an eviction story these folks apparently,0.0,0,Henderson,NV,Nevada,Clark,36.0133,-115.038,2021-05-14 03:00:00
US,2021-05-14 03:52:42,0.0,"Minneapolis, MN",Minneapolis,city,0.0,some experts for instance point to examples like israel and the united kingdom where adult,0.0,1,Minneapolis,MN,Minnesota,Hennepin,44.9635,-93.2678,2021-05-14 03:00:00
US,2021-05-14 03:52:36,0.0,"San Diego, CA",San Diego,city,0.0,and simultaneous with this good news w,0.0,1,San Diego,CA,California,San Diego,32.8312,-117.1225,2021-05-14 03:00:00
US,2021-05-14 03:51:37,0.0,"Atlanta, GA",Atlanta,city,0.0,i didn get the vaccine to stop wearing mask got it to protect me from people who refused to wear mask and,0.0,0,Atlanta,GA,Georgia,Fulton,33.7627,-84.4224,2021-05-14 03:00:00
US,2021-05-14 03:51:26,5.0,"Los Angeles, CA",Los Angeles,city,1.0,lol you gotta be the stupidest muthafucka to equate getting vaccine amidst literal pandemic that shut down the,0.0,0,Los Angeles,CA,California,Los Angeles,34.1139,-118.4068,2021-05-14 03:00:00
US,2021-05-14 03:51:00,1.0,"Boise, ID",Boise,city,0.0,get the vaccine please,0.0,1,Boise,ID,Idaho,Ada,43.6007,-116.2312,2021-05-14 03:00:00
US,2021-05-14 03:50:54,0.0,"Honolulu, HI",Honolulu,city,0.0,the second vaccine does not mess around,0.0,1,Honolulu,HI,Hawaii,Honolulu,21.3294,-157.846,2021-05-14 03:00:00
US,2021-05-14 03:50:09,0.0,"Corpus Christi, TX",Corpus Christi,city,0.0,can ever be more stressful for me than this covid year has been honestly,1.0,0,Corpus Christi,TX,Texas,Nueces,27.726,-97.3755,2021-05-14 03:00:00
US,2021-05-14 03:49:42,0.0,"Huntington Beach, CA",Huntington Beach,city,0.0,i plan on still wearing my mask indoors amp in crowds to protect others,0.0,1,Huntington Beach,CA,California,Orange,33.696,-118.0025,2021-05-14 03:00:00
US,2021-05-14 03:49:36,0.0,"Hoover, AL",Hoover,city,0.0,more canines against covid hoover metropolitan stadium,0.0,1,Hoover,AL,Alabama,Jefferson,33.3754,-86.8064,2021-05-14 03:00:00
US,2021-05-14 03:49:19,1.0,"Peru, IN",Peru,city,0.0,you re an idiot feel free to shove my vaccine up your ass,0.0,0,Peru,IN,Indiana,Miami,40.7594,-86.0757,2021-05-14 03:00:00
US,2021-05-14 03:49:03,3.0,"Newark, NJ",Newark,city,1.0,did get pfizer or are android,0.0,1,Newark,NJ,New Jersey,Essex,40.7245,-74.1725,2021-05-14 03:00:00
US,2021-05-14 03:48:54,0.0,"Luling, LA",Luling,city,0.0,how did he know blacks would start attacking asians nobody else did covid was from china what do you mean bl,0.0,1,Luling,LA,Louisiana,St. Charles,29.9008,-90.3523,2021-05-14 03:00:00
US,2021-05-14 03:48:05,1.0,"Fort Myers, FL",Fort Myers,city,0.0,do you have any idea how you contracted covid just wondering for other fully vaccinated to be,0.0,1,Fort Myers,FL,Florida,Lee,26.6195,-81.8303,2021-05-14 03:00:00
US,2021-05-14 03:47:59,30.0,"Oatfield, OR",Oatfield,city,0.0,cdc basically saying know you anti mask anti vaxers are gonna lie so we ll let natural selection take its cours,0.0,0,Oatfield,OR,Oregon,Clackamas,45.4127,-122.5942,2021-05-14 03:00:00
US,2021-05-14 03:47:40,0.0,"Huntington Beach, CA",Huntington Beach,city,0.0,great m vaccinated but m also an organ donor married to transplant recipient for those who will still conti,0.0,1,Huntington Beach,CA,California,Orange,33.696,-118.0025,2021-05-14 03:00:00
US,2021-05-14 03:47:15,1.0,"Rancho San Diego, CA",Rancho San Diego,city,1.0,wow you really like and retreat your own tweets lol m a,0.0,1,Rancho San Diego,CA,California,San Diego,32.7624,-116.9197,2021-05-14 03:00:00
US,2021-05-14 03:46:39,6.0,"Spokane, WA",Spokane,city,0.0,today was the first time since covid early impacts felt back in my flow several in person meetings walking do,0.0,1,Spokane,WA,Washington,Spokane,47.6671,-117.433,2021-05-14 03:00:00
US,2021-05-14 03:45:15,1.0,"San Francisco, CA",San Francisco,city,0.0,sadly there no vaccine for that yet,0.0,0,San Francisco,CA,California,San Francisco,37.7562,-122.443,2021-05-14 03:00:00
US,2021-05-14 03:45:14,1.0,"Palm Harbor, FL",Palm Harbor,city,0.0,yea wasn saying it was fake was just stating family memeber got moderna and it didn work,0.0,0,Palm Harbor,FL,Florida,Pinellas,28.0847,-82.7481,2021-05-14 03:00:00
US,2021-05-14 03:45:09,0.0,"Columbus, OH",Columbus,city,0.0,so it did work in australia there has been no cases for m,0.0,0,Columbus,OH,Ohio,Franklin,39.9862,-82.985,2021-05-14 03:00:00
US,2021-05-14 03:44:36,0.0,"Puyallup, WA",Puyallup,city,0.0,nope no food allowed due to covid restrictions thanks for checking,0.0,1,Puyallup,WA,Washington,Pierce,47.1794,-122.2902,2021-05-14 03:00:00
US,2021-05-14 03:44:33,1.0,"Denver, CO",Denver,city,0.0,why you need to wear mask if unvaccinated the more people the virus infects the more chances it has to mutate,0.0,1,Denver,CO,Colorado,Denver,39.7621,-104.8759,2021-05-14 03:00:00
US,2021-05-14 03:44:23,1.0,"Des Moines, IA",Des Moines,city,0.0,awesome scheduled my 12 year old today very happy to finally have that option,0.0,1,Des Moines,IA,Iowa,Polk,41.5725,-93.6105,2021-05-14 03:00:00
US,2021-05-14 03:44:20,5.0,"Paradise, NV",Paradise,city,0.0,in las vegas and over half the casino is not wearing masks today and no one cares covid is over,0.0,1,Paradise,NV,Nevada,Clark,36.0807,-115.1369,2021-05-14 03:00:00
US,2021-05-14 03:43:48,0.0,"Truckee, CA",Truckee,city,0.0,i had to give my nanny 3 days of pay and make the appointment for her we also spent day after day s,0.0,0,Truckee,CA,California,Nevada,39.3455,-120.1848,2021-05-14 03:00:00
US,2021-05-14 03:43:39,5.0,"Tucson, AZ",Tucson,city,0.0,why am hesitant to go without mask two weeks ago we let my son attend birthday party two days later he ha,0.0,1,Tucson,AZ,Arizona,Pima,32.1545,-110.8782,2021-05-14 03:00:00
US,2021-05-14 03:42:42,1.0,"Minneapolis, MN",Minneapolis,city,0.0,this is genuine question asked with the hope that if have blind spots where covid vaccination is concerned t,0.0,1,Minneapolis,MN,Minnesota,Hennepin,44.9635,-93.2678,2021-05-14 03:00:00
US,2021-05-14 03:41:57,2.0,"Phoenix, AZ",Phoenix,city,1.0,this needs to become trend in other states too many business owners were wrongly charged for defying covid rule,0.0,0,Phoenix,AZ,Arizona,Maricopa,33.5722,-112.0891,2021-05-14 03:00:00
US,2021-05-14 03:41:55,2.0,"Thornton, CO",Thornton,city,1.0,i am so proud of my boys tonight hard fought season with injuries covid schedule adjustments you guys deserve,0.0,0,Thornton,CO,Colorado,Adams,39.9197,-104.9438,2021-05-14 03:00:00
US,2021-05-14 03:41:51,0.0,"Lauderhill, FL",Lauderhill,city,0.0,impers as not,0.0,1,Lauderhill,FL,Florida,Broward,26.1605,-80.2242,2021-05-14 03:00:00
US,2021-05-14 03:41:22,3.0,"San Antonio, TX",San Antonio,city,2.0,link at mall in san antonio haley cruz 13 stood quietly in line with her parents unt,1.0,1,San Antonio,TX,Texas,Bexar,29.4658,-98.5253,2021-05-14 03:00:00
US,2021-05-14 03:40:44,1.0,"San Francisco, CA",San Francisco,city,0.0,i pointed this out in response to your remark about seeing celebs get covid like we did at start of,0.0,1,San Francisco,CA,California,San Francisco,37.7562,-122.443,2021-05-14 03:00:00
US,2021-05-14 03:40:08,1.0,"San Diego, CA",San Diego,city,0.0,bill maher has covid real time scraps friday episode deadline,0.0,1,San Diego,CA,California,San Diego,32.8312,-117.1225,2021-05-14 03:00:00
US,2021-05-14 03:39:59,4.0,"Brooklyn, NY",Brooklyn,city,0.0,i gotta go around with my vaccine card and just get all the free shit,0.0,0,Brooklyn,NY,New York,Kings,40.6501,-73.9496,2021-05-14 03:00:00
US,2021-05-14 03:39:57,0.0,"Baltimore, MD",Baltimore,city,0.0,it won even let you search he death count for the covid vaccine niggas is dyingggggg,0.0,0,Baltimore,MD,Maryland,Baltimore,39.3051,-76.6144,2021-05-14 03:00:00
US,2021-05-14 03:39:40,1.0,"Frisco, TX",Frisco,city,0.0,first covid vaccine get vaccinated,0.0,1,Frisco,TX,Texas,Collin,33.1555,-96.8215,2021-05-14 03:00:00
US,2021-05-14 03:39:23,0.0,"St Paul, MN",St Paul,city,0.0,ok that certainly doesn match the state vaccine dashboard website so,0.0,1,,,,,,,2021-05-14 03:00:00
US,2021-05-14 03:39:15,15.0,"Potomac, MD",Potomac,city,1.0,sad loss for the community jarnail singh fearless journalist who took stand on 1984 massacres amp challenged,0.0,0,Potomac,MD,Maryland,Montgomery,39.0141,-77.1943,2021-05-14 03:00:00
US,2021-05-14 03:39:06,1.0,"San Jose, CA",San Jose,city,0.0,mariners more painful than the second moderna shot,0.0,0,San Jose,CA,California,Santa Clara,37.3019,-121.8486,2021-05-14 03:00:00
US,2021-05-14 03:39:05,0.0,"Baltimore, MD",Baltimore,city,0.0,my job literally forcing this vaccine down our throats m finna be jobless come soon,0.0,1,Baltimore,MD,Maryland,Baltimore,39.3051,-76.6144,2021-05-14 03:00:00
US,2021-05-14 03:38:56,0.0,"Arlington, TX",Arlington,city,0.0,been vaccinated since late december when it came out and early january for my 2nd pfizer dose,0.0,1,Arlington,TX,Texas,Tarrant,32.6998,-97.125,2021-05-14 03:00:00
US,2021-05-14 03:38:50,0.0,"Pompano Beach, FL",Pompano Beach,city,0.0,no will not get the vaccine and you or anyone can make us get the vaccine fuck thought this was a,0.0,0,Pompano Beach,FL,Florida,Broward,26.2428,-80.1312,2021-05-14 03:00:00
US,2021-05-14 03:38:47,0.0,"Redondo Beach, CA",Redondo Beach,city,0.0,smh so the state of california literally spamming my email about the covid vaccine like how ya ll even get my email,0.0,0,Redondo Beach,CA,California,Los Angeles,33.8574,-118.3766,2021-05-14 03:00:00
US,2021-05-14 03:38:42,0.0,"Virginia Beach, VA",Virginia Beach,city,0.0,still over year out plenty of time to change loosen covid restrictions since your 1s,0.0,1,Virginia Beach,VA,Virginia,Virginia Beach,36.7335,-76.0435,2021-05-14 03:00:00
US,2021-05-14 03:38:27,0.0,"Buckeye, AZ",Buckeye,city,0.0,you know three women who had irregular periods after taking the vaccine but don believe the covid v,0.0,1,Buckeye,AZ,Arizona,Maricopa,33.4314,-112.6429,2021-05-14 03:00:00
US,2021-05-14 03:38:09,0.0,"Phoenix, AZ",Phoenix,city,0.0,all vaccinated,0.0,1,Phoenix,AZ,Arizona,Maricopa,33.5722,-112.0891,2021-05-14 03:00:00
US,2021-05-14 03:38:05,7.0,"Phoenix, AZ",Phoenix,city,2.0,phoenix college beats glendale 7 2 in game one of best of three series action resumes friday 5 14 21 at 3 00pm at,0.0,1,Phoenix,AZ,Arizona,Maricopa,33.5722,-112.0891,2021-05-14 03:00:00
US,2021-05-14 03:37:57,1.0,"Duluth, GA",Duluth,city,0.0,do we have concrete numbers again beyond teenagers on vaccine effectiveness how long exactly does the vaccine last,0.0,1,Duluth,GA,Georgia,Gwinnett,34.0053,-84.1492,2021-05-14 03:00:00
US,2021-05-14 03:37:56,0.0,"Duluth, GA",Duluth,city,0.0,so let me get this straight the says vaccinated people can go back to normal but we still don have f,0.0,1,Duluth,GA,Georgia,Gwinnett,34.0053,-84.1492,2021-05-14 03:00:00
US,2021-05-14 03:37:56,2.0,"Chicago, IL",Chicago,city,0.0,not here to start shit but if got access to the vaccine right now then go and get it there no real excuses anym,0.0,0,Chicago,IL,Illinois,Cook,41.8373,-87.6862,2021-05-14 03:00:00
US,2021-05-14 03:37:46,0.0,"Minneapolis, MN",Minneapolis,city,0.0,covid isn over it spreading in schools across the s,0.0,1,Minneapolis,MN,Minnesota,Hennepin,44.9635,-93.2678,2021-05-14 03:00:00
US,2021-05-14 03:37:44,0.0,"Missoula, MT",Missoula,city,0.0,twist what if now the anti vaxxers don want to be thought of as have taken the vaccine and now begin wea,0.0,0,Missoula,MT,Montana,Missoula,46.875,-114.0214,2021-05-14 03:00:00
US,2021-05-14 03:36:30,1.0,"Egypt Lake-Leto, FL",Egypt Lake-Leto,city,0.0,they keep giving me more and more reasons to not consider the vaccine,0.0,1,Egypt Lake-Leto,FL,Florida,Hillsborough,28.0177,-82.5062,2021-05-14 03:00:00
US,2021-05-14 03:36:13,0.0,"East Hemet, CA",East Hemet,city,0.0,exclusive judicial watch tom fitton slams dr fauci covid scandal that deserves skepticism,0.0,0,East Hemet,CA,California,Riverside,33.7301,-116.941,2021-05-14 03:00:00
US,2021-05-14 03:36:12,6.0,"Nashua, NH",Nashua,city,4.0,how to digitize covid 19 vaccine card techrepublic,0.0,1,Nashua,NH,New Hampshire,Hillsborough,42.7491,-71.491,2021-05-14 03:00:00
US,2021-05-14 03:35:15,1.0,"Cincinnati, OH",Cincinnati,city,0.0,imma slap when im done having covid,0.0,1,Cincinnati,OH,Ohio,Hamilton,39.1413,-84.5061,2021-05-14 03:00:00
US,2021-05-14 03:35:15,3.0,"Minneapolis, MN",Minneapolis,city,0.0,i ve been hearing there are variety of reasons people would choose or not be able to be vaccinated against covi,0.0,1,Minneapolis,MN,Minnesota,Hennepin,44.9635,-93.2678,2021-05-14 03:00:00
US,2021-05-14 03:35:06,1.0,"Minneapolis, MN",Minneapolis,city,0.0,that vaccine you got works better than the mask we ve come to feel safe in at the end of the day you can keep wear,0.0,1,Minneapolis,MN,Minnesota,Hennepin,44.9635,-93.2678,2021-05-14 03:00:00
US,2021-05-14 03:34:50,0.0,"Stillwater, OK",Stillwater,city,0.0,i live very happy life believe that many willfully spread misinformation,0.0,1,Stillwater,OK,Oklahoma,Payne,36.1316,-97.074,2021-05-14 03:00:00
US,2021-05-14 03:34:28,5.0,"Pittsburgh, PA",Pittsburgh,city,0.0,i don want to get the vaccine isn a good enough answer for me when you have to prove that you are vaccin,0.0,1,Pittsburgh,PA,Pennsylvania,Allegheny,40.4396,-79.9762,2021-05-14 03:00:00
US,2021-05-14 03:34:19,1.0,"Paramus, NJ",Paramus,city,0.0,i see people talking about the vaccine as the jab and instantly dislike them same people against vaccines are,0.0,0,Paramus,NJ,New Jersey,Bergen,40.9455,-74.0712,2021-05-14 03:00:00
US,2021-05-14 03:33:44,0.0,"Stillwater, OK",Stillwater,city,0.0,i know no such thing the vaccines are not killing anyone,0.0,1,Stillwater,OK,Oklahoma,Payne,36.1316,-97.074,2021-05-14 03:00:00
US,2021-05-14 03:33:40,2.0,"Lake View, NY",Lake View,city,0.0,this should say vaccinated or beat covid,0.0,1,,,,,,,2021-05-14 03:00:00
US,2021-05-14 03:33:26,2.0,"Melrose, MA",Melrose,city,1.0,great public health news regarding covid 19 in melrose,0.0,1,Melrose,MA,Massachusetts,Middlesex,42.4556,-71.059,2021-05-14 03:00:00
US,2021-05-14 03:33:17,0.0,"Elgin, IL",Elgin,city,0.0,anyone got fake vaccine card can buy ll make monthly payments,0.0,0,Elgin,IL,Illinois,Kane,42.0385,-88.3229,2021-05-14 03:00:00
US,2021-05-14 03:32:48,0.0,"Roswell, NM",Roswell,city,0.0,covid in some form has been around for years and years that is why it is so hard to eradica,0.0,0,Roswell,NM,New Mexico,Chaves,33.373,-104.5294,2021-05-14 03:00:00
US,2021-05-14 03:32:42,0.0,"Mission, KS",Mission,city,0.0,the anti abortion movement can use this myth anymore,0.0,0,Mission,KS,Kansas,Johnson,39.027,-94.6568,2021-05-14 03:00:00
US,2021-05-14 03:32:04,3.0,"Indianola, IA",Indianola,city,0.0,don be uneducated and lack common sense like cole go get your vaccine,0.0,1,Indianola,IA,Iowa,Warren,41.3629,-93.5652,2021-05-14 03:00:00
US,2021-05-14 03:32:00,4.0,"Austin, TX",Austin,city,0.0,yes exactly don care if the side effects of covid aren as bad for people who are vaccinated still don want it at all,0.0,1,Austin,TX,Texas,Travis,30.3004,-97.7522,2021-05-14 03:00:00
US,2021-05-14 03:31:45,0.0,"San Jose, CA",San Jose,city,0.0,the vaccine cards are literally the stupidest least secure thing ve ever seen,0.0,0,San Jose,CA,California,Santa Clara,37.3019,-121.8486,2021-05-14 03:00:00
US,2021-05-14 03:30:09,1.0,"Homewood, IL",Homewood,city,1.0,seychelles has 62 fully vaccinated rate granted they used sinopharm 57 astrazeneca 43 and is seeing an in,0.0,1,Homewood,IL,Illinois,Cook,41.5591,-87.661,2021-05-14 03:00:00
US,2021-05-14 03:29:02,0.0,"Larkspur, CA",Larkspur,city,1.0,8 of the just tested positive after vaccination so the vaccine doesn prevent you from spreading corona,0.0,1,Larkspur,CA,California,Marin,37.9393,-122.5313,2021-05-14 03:00:00
US,2021-05-14 03:28:41,0.0,"Hendersonville, TN",Hendersonville,city,0.0,got my vaccine brother,0.0,1,Hendersonville,TN,Tennessee,Sumner,36.3063,-86.5998,2021-05-14 03:00:00
US,2021-05-14 03:28:35,1.0,"Westlake Village, CA",Westlake Village,city,0.0,put ice pack on arm immediately afterwards and on and off for 24 hrs,0.0,1,Westlake Village,CA,California,Los Angeles,34.1369,-118.822,2021-05-14 03:00:00
US,2021-05-14 03:28:29,0.0,"Marquette, MI",Marquette,city,0.0,so very true but can you imagine the torment of faking vaccine and living wreckless life with the thought that,0.0,0,Marquette,MI,Michigan,Marquette,46.544,-87.4082,2021-05-14 03:00:00
US,2021-05-14 03:28:09,20.0,"Norfolk, VA",Norfolk,city,1.0,seeing people in their 40s trying to purchase falsified vaccine cards on facebook remarkable,0.0,1,Norfolk,VA,Virginia,Norfolk,36.8945,-76.259,2021-05-14 03:00:00
US,2021-05-14 03:27:59,0.0,"Houston, TX",Houston,city,0.0,the vaccine fun juice,0.0,1,Houston,TX,Texas,Harris,29.7863,-95.3889,2021-05-14 03:00:00
US,2021-05-14 03:27:42,3.0,"Queens, NY",Queens,city,0.0,further it helps push ridiculously false risk calculations on covid,0.0,0,Queens,NY,New York,Queens,40.7498,-73.7976,2021-05-14 03:00:00
US,2021-05-14 03:27:29,2.0,"Tulsa, OK",Tulsa,city,0.0,yes until all my children get the vaccine my 12 year old gets his first vaccine tomorrow and my 11 year old is t,0.0,1,Tulsa,OK,Oklahoma,Tulsa,36.1284,-95.9042,2021-05-14 03:00:00
US,2021-05-14 03:27:18,4.0,"Aptos, CA",Aptos,city,0.0,rather be called that than be guinea pig for pharmaceutical trials that have been granted full immu,0.0,1,Aptos,CA,California,Santa Cruz,36.9912,-121.8934,2021-05-14 03:00:00
US,2021-05-14 03:26:21,0.0,"Santaquin, UT",Santaquin,city,0.0,i have never been to japan however they are in constant state of emergency because,0.0,0,Santaquin,UT,Utah,Utah,39.9711,-111.7937,2021-05-14 03:00:00
US,2021-05-14 03:26:02,1.0,"Norfolk, VA",Norfolk,city,0.0,unless the unvaccinated people are mutating variant my vacci,0.0,1,Norfolk,VA,Virginia,Norfolk,36.8945,-76.259,2021-05-14 03:00:00
US,2021-05-14 03:25:51,0.0,"Long Beach, CA",Long Beach,city,0.0,covid quilt,0.0,1,Long Beach,CA,California,Los Angeles,33.7981,-118.1675,2021-05-14 03:00:00
