country_code,date,likes,place_full_name,place_name,place_type,retweets,text,verified,Sentiment Label,city,state_id,state_name,county_name,lat,lng,round_date
US,2021-05-14 20:21:21,0.0,"Los Angeles, CA",Los Angeles,city,0.0,they are lucky who have not been exposed it totally possibl,0.0,1,Los Angeles,CA,California,Los Angeles,34.1139,-118.4068,2021-05-14 20:00:00
US,2021-05-14 20:21:21,5.0,"Tampa, FL",Tampa,city,1.0,also need to include those who have the antibodies from having covid and having cleared it naturally all the data,0.0,1,Tampa,FL,Florida,Hillsborough,27.9942,-82.4451,2021-05-14 20:00:00
US,2021-05-14 20:21:16,36.0,"Natick, MA",Natick,city,0.0,they test for the 5g microchips implanted by the vaccine duh,0.0,1,,,,,,,2021-05-14 20:00:00
US,2021-05-14 20:21:13,0.0,"Boston, MA",Boston,city,0.0,people who are against wearing masks are for the most part vaccine hesitant as,0.0,0,Boston,MA,Massachusetts,Suffolk,42.3188,-71.0846,2021-05-14 20:00:00
US,2021-05-14 20:20:35,1.0,"Lorton, VA",Lorton,city,0.0,consider all the people that have died or permanent injury from this vaccine wake up do y,0.0,0,Lorton,VA,Virginia,Fairfax,38.6984,-77.2163,2021-05-14 20:00:00
US,2021-05-14 20:20:28,0.0,"Brooklyn, NY",Brooklyn,city,0.0,ok but why covid gotta come when m 18 20,0.0,1,Brooklyn,NY,New York,Kings,40.6501,-73.9496,2021-05-14 20:00:00
US,2021-05-14 20:20:04,1.0,"Altadena, CA",Altadena,city,0.0,covid 19 vaccination clinic for people experiencing homelessness in provided in partnership with ho,0.0,1,Altadena,CA,California,Los Angeles,34.1928,-118.1345,2021-05-14 20:00:00
US,2021-05-14 20:19:39,1.0,"Lorton, VA",Lorton,city,0.0,do you know how many people who have been fully vaccinated and have gotten co,0.0,1,Lorton,VA,Virginia,Fairfax,38.6984,-77.2163,2021-05-14 20:00:00
US,2021-05-14 20:19:17,0.0,"Dallas, TX",Dallas,city,0.0,fighting arguing picking at someone who doesn have the same beliefs as you covid life choices where we work,0.0,0,Dallas,TX,Texas,Dallas,32.7936,-96.7662,2021-05-14 20:00:00
US,2021-05-14 20:17:39,0.0,"Placentia, CA",Placentia,city,0.0,see our latest ca pharmacy technician retail store job opportunity and click the link in our bio to a,0.0,1,Placentia,CA,California,Orange,33.8807,-117.8553,2021-05-14 20:00:00
US,2021-05-14 20:17:19,0.0,"Lorton, VA",Lorton,city,0.0,yeah how about those eight yankee players that were vaccinated and got covid wake up,0.0,1,Lorton,VA,Virginia,Fairfax,38.6984,-77.2163,2021-05-14 20:00:00
US,2021-05-14 20:16:42,0.0,"Oakland, CA",Oakland,city,0.0,damion lee of the golden state warriors also got covid after being vaccinated he was extremely ill for 8,0.0,0,Oakland,CA,California,Alameda,37.7903,-122.2165,2021-05-14 20:00:00
US,2021-05-14 20:16:25,2.0,"State College, PA",State College,city,0.0,what vaccine did you get the mederma,0.0,1,State College,PA,Pennsylvania,Centre,40.7909,-77.8568,2021-05-14 20:00:00
US,2021-05-14 20:16:16,6.0,"Honolulu, HI",Honolulu,city,2.0,if your dumb ass vaccine works don be worried if don get mine all were screaming my body my choice so please shut the fuck up,0.0,0,Honolulu,HI,Hawaii,Honolulu,21.3294,-157.846,2021-05-14 20:00:00
US,2021-05-14 20:16:09,0.0,"Mercer Island, WA",Mercer Island,city,0.0,ahh the bane of millers existence is the loss of the wh what repugnant individual the hill lawsuit from ste,0.0,0,Mercer Island,WA,Washington,King,47.5661,-122.232,2021-05-14 20:00:00
US,2021-05-14 20:16:09,0.0,"Pico Rivera, CA",Pico Rivera,city,0.0,taking the vaccine then wishing everyone who doesn take it dies is going to bite you so hard in the ass the universe don play games,0.0,0,Pico Rivera,CA,California,Los Angeles,33.9902,-118.0888,2021-05-14 20:00:00
US,2021-05-14 20:15:59,0.0,"Miami, FL",Miami,city,0.0,actually 8 players from the yankees have covid and are vaccinated lot of twitter friends have,0.0,1,Miami,FL,Florida,Miami-Dade,25.7839,-80.2102,2021-05-14 20:00:00
US,2021-05-14 20:15:09,0.0,"Brighton, MI",Brighton,city,0.0,if jobs with titles like pharmacy technician covid vaccine support sound appealing to you follow us to hear abo,0.0,1,Brighton,MI,Michigan,Livingston,42.5298,-83.7847,2021-05-14 20:00:00
US,2021-05-14 20:15:07,1.0,"Philadelphia, PA",Philadelphia,city,0.0,marshall plan meets moonshot make the us humanity covid medicine cabinet something to th,0.0,1,Philadelphia,PA,Pennsylvania,Philadelphia,40.0077,-75.1339,2021-05-14 20:00:00
US,2021-05-14 20:15:01,2.0,"Stoughton, WI",Stoughton,city,0.0,hitting up my first celebratory karaoke after covid and demanding to belt out donovan i am the shaman,0.0,0,Stoughton,WI,Wisconsin,Dane,42.9234,-89.2215,2021-05-14 20:00:00
US,2021-05-14 20:14:29,0.0,"Houston, TX",Houston,city,0.0,if you can get the flu vaccine and still get the flu do have to continue,0.0,0,Houston,TX,Texas,Harris,29.7863,-95.3889,2021-05-14 20:00:00
US,2021-05-14 20:14:23,1.0,"Lakewood, NJ",Lakewood,city,0.0,i have been fan of approach to covid but this is not logical if the cdc says you don need to wear a,0.0,1,,,,,,,2021-05-14 20:00:00
US,2021-05-14 20:14:21,0.0,"Sun City Center, FL",Sun City Center,city,0.0,moveon over 3 million people daily watch tucker carlson on fox news more than any cable news show in april alone,0.0,0,Sun City Center,FL,Florida,Hillsborough,27.7149,-82.3569,2021-05-14 20:00:00
US,2021-05-14 20:14:09,0.0,"Freeport, ME",Freeport,city,0.0,cvs health is hiring in freeport me click the link in our bio to apply pharmacy technician covid 19 vaccine sup,0.0,1,,,,,,,2021-05-14 20:00:00
US,2021-05-14 20:14:03,9.0,"Chicago, IL",Chicago,city,0.0,showed the doorman my vax card at the club last night and removed my mask sense of empowerment flowed down my ve,0.0,1,Chicago,IL,Illinois,Cook,41.8373,-87.6862,2021-05-14 20:00:00
US,2021-05-14 20:14:00,0.0,"Houston, TX",Houston,city,0.0,so when do you propose that we remove masks and open up again 30 of american,0.0,1,Houston,TX,Texas,Harris,29.7863,-95.3889,2021-05-14 20:00:00
US,2021-05-14 20:13:45,30.0,"O'Fallon, MO",O'Fallon,city,1.0,should just wear my vaccine card on lanyard around my neck so nobody thinks m republican,0.0,1,O'Fallon,MO,Missouri,St. Charles,38.785,-90.7175,2021-05-14 20:00:00
US,2021-05-14 20:13:14,0.0,"Anderson Mill, TX",Anderson Mill,city,0.0,wow just 12 people are behind most vaccine hoaxes on social media research shows,0.0,1,,,,,,,2021-05-14 20:00:00
US,2021-05-14 20:12:50,0.0,"Las Vegas, NV",Las Vegas,city,0.0,and if all businesses do this vaccine rates will skyrocket,0.0,1,Las Vegas,NV,Nevada,Clark,36.2333,-115.2654,2021-05-14 20:00:00
US,2021-05-14 20:12:31,0.0,"Salt Lake City, UT",Salt Lake City,city,0.0,i more that little disappointed in the new cdc mask policy it seems like they caved to the worst of the worst,0.0,0,Salt Lake City,UT,Utah,Salt Lake,40.7777,-111.9306,2021-05-14 20:00:00
US,2021-05-14 20:11:46,0.0,"Lorton, VA",Lorton,city,0.0,not everybody can get the vaccine so stop being so ignorant people with severe allergies plus,0.0,0,Lorton,VA,Virginia,Fairfax,38.6984,-77.2163,2021-05-14 20:00:00
US,2021-05-14 20:11:30,0.0,"Ontario, CA",Ontario,city,0.0,yes if someone chooses not to get the vaccine that on them ll assume those wh,0.0,1,Ontario,CA,California,San Bernardino,34.0393,-117.6064,2021-05-14 20:00:00
US,2021-05-14 20:10:29,0.0,"San Diego, CA",San Diego,city,0.0,we got bad news about my daughters cancer week ago so it been bad week but my 14 amp 12 yr old got t,0.0,0,San Diego,CA,California,San Diego,32.8312,-117.1225,2021-05-14 20:00:00
US,2021-05-14 20:10:09,0.0,"Hinsdale, IL",Hinsdale,city,0.0,i just finished my last day of high school it was weird feeling finishing these classes for the last time and a,0.0,0,Hinsdale,IL,Illinois,DuPage,41.8005,-87.9273,2021-05-14 20:00:00
US,2021-05-14 20:08:59,1.0,"Charlotte, NC",Charlotte,city,0.0,yes until the entire outside is vaccinated until they put the vaccine in chemtrails and see one in the sky,0.0,1,Charlotte,NC,North Carolina,Mecklenburg,35.208,-80.8304,2021-05-14 20:00:00
US,2021-05-14 20:08:52,0.0,"Lorton, VA",Lorton,city,0.0,it not vaccine it gene therapy it not fda approved it takes 5 to 10 years to appro,0.0,0,Lorton,VA,Virginia,Fairfax,38.6984,-77.2163,2021-05-14 20:00:00
US,2021-05-14 20:08:29,7.0,"Chandler, AZ",Chandler,city,0.0,my first post covid portrait client didn take the discount offered and gave me tip,0.0,1,Chandler,AZ,Arizona,Maricopa,33.2826,-111.8516,2021-05-14 20:00:00
US,2021-05-14 20:08:08,0.0,"Chesapeake, VA",Chesapeake,city,0.0,that would be beautiful thing just hope that they have different stipulation,0.0,1,Chesapeake,VA,Virginia,Chesapeake,36.6778,-76.3024,2021-05-14 20:00:00
US,2021-05-14 20:07:40,0.0,"Baton Rouge, LA",Baton Rouge,city,0.0,lord these anti vaccine people,0.0,0,Baton Rouge,LA,Louisiana,East Baton Rouge,30.4418,-91.131,2021-05-14 20:00:00
US,2021-05-14 20:07:29,0.0,"Providence, RI",Providence,city,0.0,see our latest providence ri job and click to apply pharmacist covid vaccine support,1.0,1,Providence,RI,Rhode Island,Providence,41.823,-71.4187,2021-05-14 20:00:00
US,2021-05-14 20:06:47,0.0,"Gardner, MA",Gardner,city,0.0,see our latest ma pharmacy technician retail store job opportunity and click the link in our bio to app,0.0,1,Gardner,MA,Massachusetts,Worcester,42.5845,-71.9867,2021-05-14 20:00:00
US,2021-05-14 20:06:34,5.0,"Los Angeles, CA",Los Angeles,city,0.0,the vaccine to me right now,0.0,1,Los Angeles,CA,California,Los Angeles,34.1139,-118.4068,2021-05-14 20:00:00
US,2021-05-14 20:06:20,0.0,"Los Angeles, CA",Los Angeles,city,0.0,the teen studies for pfizer and moderna are far enough along that they are will get eua,0.0,1,Los Angeles,CA,California,Los Angeles,34.1139,-118.4068,2021-05-14 20:00:00
US,2021-05-14 20:06:01,0.0,"Galena, IL",Galena,city,0.0,it feels normal to bob my head to drops of jupiter while the white sox play on bar television it honestly ideal thank you vaccine,0.0,1,Galena,IL,Illinois,Jo Daviess,42.4218,-90.4293,2021-05-14 20:00:00
US,2021-05-14 20:05:42,0.0,"Roswell, NM",Roswell,city,0.0,also picked up some of the information that was on the news and stuff about covid when it first came out,0.0,1,Roswell,NM,New Mexico,Chaves,33.373,-104.5294,2021-05-14 20:00:00
US,2021-05-14 20:05:07,1.0,"San Francisco, CA",San Francisco,city,0.0,bruh it literally the people that are complaining just to complain that are prolonging this pandemic first all,0.0,0,San Francisco,CA,California,San Francisco,37.7562,-122.443,2021-05-14 20:00:00
US,2021-05-14 20:04:54,1.0,"Winchester, NV",Winchester,city,0.0,people are stupid get the vaccine if you want to go maskless there isn an issue with access to it either,0.0,0,Winchester,NV,Nevada,Clark,36.1368,-115.1299,2021-05-14 20:00:00
US,2021-05-14 20:04:30,12.0,"Oakland, CA",Oakland,city,0.0,a good character trashing but what is the point florida is hardly covid success story,0.0,1,Oakland,CA,California,Alameda,37.7903,-122.2165,2021-05-14 20:00:00
US,2021-05-14 20:04:29,0.0,"Stoughton, MA",Stoughton,city,0.0,don you find it strange that you re bringing my penis size into conversation about covid 19 that,0.0,0,,,,,,,2021-05-14 20:00:00
US,2021-05-14 20:04:07,2.0,"Durango, CO",Durango,city,0.0,submissions to our issue covid 19 are now open check out our sweet new submission form at or don t,0.0,1,Durango,CO,Colorado,La Plata,37.2659,-107.8782,2021-05-14 20:00:00
US,2021-05-14 20:01:58,0.0,"Jericho, NY",Jericho,city,0.0,i don understand why two weeks after amp vaccine is considered fully vaccinated but not two weeks af,0.0,1,Jericho,NY,New York,Nassau,40.7875,-73.5416,2021-05-14 20:00:00
US,2021-05-14 20:01:50,7.0,"Columbus, OH",Columbus,city,0.0,leadership in action putting in some vaccine work over at the schott,0.0,1,Columbus,OH,Ohio,Franklin,39.9862,-82.985,2021-05-14 20:00:00
US,2021-05-14 20:01:46,1.0,"Raleigh, NC",Raleigh,city,0.0,some don understand how it works 96 effective is 4 ineffective and the law of large numbers will,0.0,1,Raleigh,NC,North Carolina,Wake,35.8325,-78.6435,2021-05-14 20:00:00
US,2021-05-14 20:01:19,1.0,"Galt, CA",Galt,city,0.0,want to work in galt ca view our latest opening,1.0,1,Galt,CA,California,Sacramento,38.2693,-121.3,2021-05-14 20:00:00
US,2021-05-14 20:00:53,5.0,"Chapel Hill, NC",Chapel Hill,city,0.0,an important parish update on covid 19,0.0,1,Chapel Hill,NC,North Carolina,Orange,35.927,-79.0391,2021-05-14 20:00:00
US,2021-05-14 19:58:30,0.0,"Windemere, TX",Windemere,city,0.0,can you recommend anyone for this job covid 19 vaccine support pharmacy technician tx,0.0,1,,,,,,,2021-05-14 19:00:00
US,2021-05-14 19:58:00,0.0,"Snellville, GA",Snellville,city,0.0,so did miss the memo about covid not existing any more orrrrrr,0.0,0,Snellville,GA,Georgia,Gwinnett,33.8563,-84.0038,2021-05-14 19:00:00
US,2021-05-14 19:57:46,3.0,"Henderson, NV",Henderson,city,0.0,totally understandable if they could do this tho that would be awesome anything to punish those who refuse the vaccine,0.0,0,Henderson,NV,Nevada,Clark,36.0133,-115.038,2021-05-14 19:00:00
US,2021-05-14 19:57:38,6.0,"Los Angeles, CA",Los Angeles,city,0.0,i don think ll be able to stream today still feel so terrible after this second covid vaccine if anyone woul,0.0,0,Los Angeles,CA,California,Los Angeles,34.1139,-118.4068,2021-05-14 19:00:00
US,2021-05-14 19:56:57,0.0,"Cary, NC",Cary,city,0.0,drop the mask mandate for the fans restrictions have been lifted by the president the governor and cdc no,0.0,0,Cary,NC,North Carolina,Wake,35.782,-78.8191,2021-05-14 19:00:00
US,2021-05-14 19:56:48,0.0,"Honolulu, HI",Honolulu,city,0.0,why wonder about the vaccine after being sick during the same time smh,0.0,0,Honolulu,HI,Hawaii,Honolulu,21.3294,-157.846,2021-05-14 19:00:00
US,2021-05-14 19:56:29,0.0,"Warren, RI",Warren,city,0.0,i personally don have the vaccine nor want it but know that all those around me who do don t,0.0,0,,,,,,,2021-05-14 19:00:00
US,2021-05-14 19:56:26,0.0,"Manhattan, NY",Manhattan,city,0.0,normally hate how busy penn station is but seeing people lined up to get their vaccine here makes my day,0.0,0,Manhattan,NY,New York,New York,40.7834,-73.9662,2021-05-14 19:00:00
US,2021-05-14 19:55:04,2.0,"Port Arthur, TX",Port Arthur,city,0.0,the vaccine doesn guarantee immunity you bum ass as every other says my body my choice,0.0,0,Port Arthur,TX,Texas,Jefferson,29.8554,-93.9264,2021-05-14 19:00:00
US,2021-05-14 19:54:24,104.0,"Charlotte, NC",Charlotte,city,5.0,finding gas and lifting covid restrictions all in the same week great times in carolina,1.0,1,Charlotte,NC,North Carolina,Mecklenburg,35.208,-80.8304,2021-05-14 19:00:00
US,2021-05-14 19:54:14,0.0,"Arlington, VA",Arlington,city,0.0,there have been reports that vaccine seems to resolve long haul symptoms have friends amp family who,0.0,1,Arlington,VA,Virginia,Arlington,38.8786,-77.1011,2021-05-14 19:00:00
US,2021-05-14 19:54:14,0.0,"Chino Hills, CA",Chino Hills,city,0.0,ugh weird ve been able to avoid covid test this whole time and don want to do nasal swab test ever,0.0,0,Chino Hills,CA,California,San Bernardino,33.9508,-117.7253,2021-05-14 19:00:00
US,2021-05-14 19:53:57,0.0,"Raleigh, NC",Raleigh,city,0.0,8 yankees test positive for covid after getting vaccinated,0.0,1,Raleigh,NC,North Carolina,Wake,35.8325,-78.6435,2021-05-14 19:00:00
US,2021-05-14 19:53:52,0.0,"Schererville, IN",Schererville,city,0.0,yeah well we had the first year of covid with false info and complete bs so you have to try to deal with it somehow guess,0.0,1,Schererville,IN,Indiana,Lake,41.486,-87.444,2021-05-14 19:00:00
US,2021-05-14 19:53:13,0.0,"Manhattan, NY",Manhattan,city,0.0,have you talked to the parents of pre teens who have suicided over bipartisan covid induced lockdow,0.0,1,Manhattan,NY,New York,New York,40.7834,-73.9662,2021-05-14 19:00:00
US,2021-05-14 19:53:07,0.0,"Fair Lawn, NJ",Fair Lawn,city,0.0,this pharmacy technician retail store job might be great fit for you click the link in our bio to see it and m,0.0,1,Fair Lawn,NJ,New Jersey,Bergen,40.9359,-74.1177,2021-05-14 19:00:00
US,2021-05-14 19:53:04,0.0,"Kingston, NY",Kingston,city,0.0,my nephew is against getting the vaccine or any for that matter m for it and have gotten mine only,0.0,1,Kingston,NY,New York,Ulster,41.9295,-73.9968,2021-05-14 19:00:00
US,2021-05-14 19:52:54,2.0,"Nashville, TN",Nashville,city,0.0,7 you may know you re fully vaccinated but not everyone else does so some people may wear mask to put those th,0.0,1,Nashville,TN,Tennessee,Davidson,36.1715,-86.7843,2021-05-14 19:00:00
US,2021-05-14 19:52:34,0.0,"Lincoln Park, NJ",Lincoln Park,city,0.0,i rlly nervous abt the vax anyone with experience which one should get and tell me about ur experience mayb,0.0,0,Lincoln Park,NJ,New Jersey,Morris,40.9239,-74.3035,2021-05-14 19:00:00
US,2021-05-14 19:52:28,0.0,"Los Angeles, CA",Los Angeles,city,0.0,these vaccine magnet videos aren freaking anyone else out,0.0,0,Los Angeles,CA,California,Los Angeles,34.1139,-118.4068,2021-05-14 19:00:00
US,2021-05-14 19:52:01,3.0,"Lakeville, MN",Lakeville,city,0.0,and we mask because we don know everything about covid yet,0.0,1,Lakeville,MN,Minnesota,Dakota,44.6774,-93.252,2021-05-14 19:00:00
US,2021-05-14 19:51:56,1.0,"Tallahassee, FL",Tallahassee,city,0.0,vaccine or not stay the hell away from me,0.0,1,Tallahassee,FL,Florida,Leon,30.4551,-84.2526,2021-05-14 19:00:00
US,2021-05-14 19:51:48,5.0,"Delaware, OH",Delaware,city,0.0,government have if you die you die approach to covid,0.0,0,Delaware,OH,Ohio,Delaware,40.2866,-83.0747,2021-05-14 19:00:00
US,2021-05-14 19:51:44,1.0,"Hopewell, VA",Hopewell,city,0.0,what infuriates me is same sex relationships is also against her religion yet forgiv,0.0,0,Hopewell,VA,Virginia,Hopewell,37.2915,-77.2985,2021-05-14 19:00:00
US,2021-05-14 19:51:37,0.0,"Schererville, IN",Schererville,city,0.0,yeah there that too what listened to was specific to not showing any antibodies and what if anyth,0.0,1,Schererville,IN,Indiana,Lake,41.486,-87.444,2021-05-14 19:00:00
US,2021-05-14 19:51:34,0.0,"Brooklyn, NY",Brooklyn,city,0.0,this is public health advice we can get behind,0.0,1,Brooklyn,NY,New York,Kings,40.6501,-73.9496,2021-05-14 19:00:00
US,2021-05-14 19:50:54,0.0,"Coon Rapids, MN",Coon Rapids,city,0.0,see our latest mn job and click to apply acute dialysis registered nurse rn prn covid 19,0.0,1,Coon Rapids,MN,Minnesota,Anoka,45.1755,-93.3095,2021-05-14 19:00:00
US,2021-05-14 19:50:47,0.0,"Omaha, NE",Omaha,city,0.0,thursday may 13 covid 19 update lincoln reports nebraska first case of india variant,0.0,1,Omaha,NE,Nebraska,Douglas,41.2627,-96.0522,2021-05-14 19:00:00
US,2021-05-14 19:49:58,0.0,"West Seneca, NY",West Seneca,city,0.0,there is no factual proven reason not to get the vaccine the death rate of this horrific disease should,0.0,0,,,,,,,2021-05-14 19:00:00
US,2021-05-14 19:49:38,0.0,"Irving, TX",Irving,city,0.0,you seem reasonable like you are just asking questions here is the bill m,0.0,1,Irving,TX,Texas,Dallas,32.8584,-96.9702,2021-05-14 19:00:00
US,2021-05-14 19:49:33,33.0,"Alexandria, VA",Alexandria,city,0.0,my body just expelled both doses of pfizer,1.0,0,Alexandria,VA,Virginia,Alexandria,38.8185,-77.0861,2021-05-14 19:00:00
US,2021-05-14 19:49:31,0.0,"Atlanta, GA",Atlanta,city,0.0,i understand how you feel but really it on them the vaccine is 95 effective against contracting t,0.0,1,Atlanta,GA,Georgia,Fulton,33.7627,-84.4224,2021-05-14 19:00:00
US,2021-05-14 19:49:24,0.0,"Shelbyville, KY",Shelbyville,city,0.0,can you recommend anyone for this job in ky,0.0,1,Shelbyville,KY,Kentucky,Shelby,38.2069,-85.2293,2021-05-14 19:00:00
US,2021-05-14 19:49:20,0.0,"Oakland, CA",Oakland,city,0.0,got the 2nd moderna shot yesterday today achy amp slight fever and my smell is off smells like salty ocean air,0.0,1,Oakland,CA,California,Alameda,37.7903,-122.2165,2021-05-14 19:00:00
US,2021-05-14 19:48:56,0.0,"Culver City, CA",Culver City,city,0.0,i on prep amp both doses of moderna it fine,0.0,1,Culver City,CA,California,Los Angeles,34.0058,-118.3968,2021-05-14 19:00:00
US,2021-05-14 19:48:56,3.0,"Delaware, OH",Delaware,city,0.0,covid cases deaths rising but want us to stop wearing our masks,0.0,0,Delaware,OH,Ohio,Delaware,40.2866,-83.0747,2021-05-14 19:00:00
US,2021-05-14 19:48:36,0.0,"Marion, VA",Marion,city,0.0,can you recommend anyone for this job covid 19 vaccine support pharmacy technician va,0.0,1,Marion,VA,Virginia,Smyth,36.8389,-81.5135,2021-05-14 19:00:00
US,2021-05-14 19:48:09,0.0,"Tallahassee, FL",Tallahassee,city,0.0,this is important,0.0,1,Tallahassee,FL,Florida,Leon,30.4551,-84.2526,2021-05-14 19:00:00
US,2021-05-14 19:48:00,0.0,"San Diego, CA",San Diego,city,0.0,ceo decided to halt covid relief pay then give himself 22 4 million compensation the average em,0.0,1,San Diego,CA,California,San Diego,32.8312,-117.1225,2021-05-14 19:00:00
US,2021-05-14 19:47:33,1.0,"Phoenix, AZ",Phoenix,city,2.0,our weekly covid 19 data update,0.0,1,Phoenix,AZ,Arizona,Maricopa,33.5722,-112.0891,2021-05-14 19:00:00
US,2021-05-14 19:47:32,1.0,"Dallas, TX",Dallas,city,0.0,get the vaccine or listen to this episode the choice is yours,0.0,1,Dallas,TX,Texas,Dallas,32.7936,-96.7662,2021-05-14 19:00:00
US,2021-05-14 19:47:04,0.0,"Colorado Springs, CO",Colorado Springs,city,0.0,if you re looking for work in co check out this pharmacy technician retail store job via the l,0.0,1,Colorado Springs,CO,Colorado,El Paso,38.8674,-104.7606,2021-05-14 19:00:00
US,2021-05-14 19:47:00,0.0,"Chicago, IL",Chicago,city,0.0,not outside but will have one with me if plan on going inside anywhere still avoiding crowds fe,0.0,0,Chicago,IL,Illinois,Cook,41.8373,-87.6862,2021-05-14 19:00:00
US,2021-05-14 19:46:33,0.0,"Irving, TX",Irving,city,0.0,i get what you re asking it remains you can still get covid even being vaxxed goo,0.0,1,Irving,TX,Texas,Dallas,32.8584,-96.9702,2021-05-14 19:00:00
US,2021-05-14 19:46:30,0.0,"Honolulu, HI",Honolulu,city,0.0,literally look what all did so since iv already had covid and have the antibodies for it don need to get vac,0.0,1,Honolulu,HI,Hawaii,Honolulu,21.3294,-157.846,2021-05-14 19:00:00
US,2021-05-14 19:46:15,0.0,"Paradise, NV",Paradise,city,0.0,i legit just told you first thing said was everyone should still be wearing mask have,0.0,1,Paradise,NV,Nevada,Clark,36.0807,-115.1369,2021-05-14 19:00:00
US,2021-05-14 19:45:46,1.0,"Kansas City, MO",Kansas City,city,1.0,in most places across the metro if you re fully vaccinated masks are not required some places still encourage ma,1.0,1,Kansas City,MO,Missouri,Jackson,39.1239,-94.5541,2021-05-14 19:00:00
US,2021-05-14 19:45:38,6.0,"San Francisco, CA",San Francisco,city,0.0,gonna go ahead and say that the wait time between doses of moderna made me think of something,1.0,1,San Francisco,CA,California,San Francisco,37.7562,-122.443,2021-05-14 19:00:00
US,2021-05-14 19:45:38,0.0,"Newburgh, IN",Newburgh,city,0.0,mark refuses to get the vaccine and it the most upsetting thing to me in the world,0.0,0,Newburgh,IN,Indiana,Warrick,37.9494,-87.4053,2021-05-14 19:00:00
US,2021-05-14 19:45:37,0.0,"Alexandria, VA",Alexandria,city,0.0,red snowflakes and other news,0.0,1,Alexandria,VA,Virginia,Alexandria,38.8185,-77.0861,2021-05-14 19:00:00
US,2021-05-14 19:45:23,0.0,"Fort Wayne, IN",Fort Wayne,city,0.0,how did you feel the first pfizer was horrible for me,0.0,0,Fort Wayne,IN,Indiana,Allen,41.0886,-85.1437,2021-05-14 19:00:00
US,2021-05-14 19:45:07,1.0,"Los Angeles, CA",Los Angeles,city,0.0,i got the moderna version did you have any side effects,0.0,1,Los Angeles,CA,California,Los Angeles,34.1139,-118.4068,2021-05-14 19:00:00
US,2021-05-14 19:44:37,1.0,"Dublin, OH",Dublin,city,0.0,as predicted we paid more income tax reduced income covid for 3rd straight yr bc of course w,0.0,1,Dublin,OH,Ohio,Franklin,40.1112,-83.1454,2021-05-14 19:00:00
US,2021-05-14 19:44:16,0.0,"Queens, NY",Queens,city,0.0,out here getting my 2nd dose of covid vaccine wish me luck thanks,0.0,1,Queens,NY,New York,Queens,40.7498,-73.7976,2021-05-14 19:00:00
US,2021-05-14 19:43:42,0.0,"Clinton, MI",Clinton,city,0.0,thought accidentally threw away my covid vaccine card during the move and was freaking out not sure how much po,0.0,0,Clinton,MI,Michigan,Lenawee,42.0699,-83.9687,2021-05-14 19:00:00
US,2021-05-14 19:43:38,3.0,"Franklin, TN",Franklin,city,0.0,how do you give hashtag soul and meaning follow through with your actions even during days of ev,0.0,1,Franklin,TN,Tennessee,Williamson,35.9216,-86.8525,2021-05-14 19:00:00
US,2021-05-14 19:42:47,2.0,"San Diego, CA",San Diego,city,0.0,2nd covid vaccination now can legally walk talk without face mask on per ca state mandate aw yeah,0.0,1,San Diego,CA,California,San Diego,32.8312,-117.1225,2021-05-14 19:00:00
US,2021-05-14 19:42:05,0.0,"Manhattan, NY",Manhattan,city,0.0,there lots of things you can catch in the nyc subway but covid ain gonna be one of em,0.0,1,Manhattan,NY,New York,New York,40.7834,-73.9662,2021-05-14 19:00:00
US,2021-05-14 19:41:59,0.0,"Raleigh, NC",Raleigh,city,1.0,graduations are happening all around us this week feel safer in your celebrations all summer long by getting the c,0.0,1,Raleigh,NC,North Carolina,Wake,35.8325,-78.6435,2021-05-14 19:00:00
US,2021-05-14 19:41:19,2.0,"Denver, CO",Denver,city,0.0,300 next season if he doesn get hurt or covid protocall d,0.0,0,Denver,CO,Colorado,Denver,39.7621,-104.8759,2021-05-14 19:00:00
US,2021-05-14 19:40:46,2.0,"Los Angeles, CA",Los Angeles,city,0.0,i love that don neurotically check covid numbers every single day anymore this is peace,0.0,1,Los Angeles,CA,California,Los Angeles,34.1139,-118.4068,2021-05-14 19:00:00
US,2021-05-14 19:40:06,0.0,"Washington, DC",Washington,city,0.0,i thought this was common knowledge atp breakthrough covid 19 infections in fully vaccinated people are to be,0.0,1,Washington,DC,District of Columbia,District of Columbia,38.9047,-77.0163,2021-05-14 19:00:00
