country_code,date,likes,place_full_name,place_name,place_type,retweets,text,verified,Sentiment Label,city,state_id,state_name,county_name,lat,lng,round_date
US,2021-05-14 14:52:12,123.0,"Nashville, TN",Nashville,city,10.0,this is what have been saying whatever side of the coin folks stand on about the vaccine fol,0.0,1,Nashville,TN,Tennessee,Davidson,36.1715,-86.7843,2021-05-14 14:00:00
US,2021-05-14 14:51:41,2.0,"Elizabeth, NJ",Elizabeth,city,1.0,i acknowledge president trump literally tireless efforts to have gotten the vaccine don choose,0.0,1,Elizabeth,NJ,New Jersey,Union,40.6657,-74.1912,2021-05-14 14:00:00
US,2021-05-14 14:50:27,4.0,"Davis, CA",Davis,city,0.0,this nigga just another trump but on some real shit we gotta get them fake vaccine cards poppin cuz m too,0.0,0,Davis,CA,California,Yolo,38.5552,-121.7365,2021-05-14 14:00:00
US,2021-05-14 14:50:01,0.0,"La Vista, NE",La Vista,city,0.0,isn it easier to just get antibodies since this will mutate just like the flu what next covid 20 vaccine,0.0,1,La Vista,NE,Nebraska,Sarpy,41.1816,-96.0666,2021-05-14 14:00:00
US,2021-05-14 14:49:57,0.0,"Fresno, TX",Fresno,city,0.0,doctor behind covid vaccine says development took years via,0.0,1,Fresno,TX,Texas,Fort Bend,29.5358,-95.4696,2021-05-14 14:00:00
US,2021-05-14 14:49:46,0.0,"Albuquerque, NM",Albuquerque,city,0.0,i surprised they re not doing vaccine tiktoks yet,0.0,1,Albuquerque,NM,New Mexico,Bernalillo,35.1053,-106.6464,2021-05-14 14:00:00
US,2021-05-14 14:49:08,0.0,"Brooklyn, NY",Brooklyn,city,0.0,incentive new york,0.0,1,Brooklyn,NY,New York,Kings,40.6501,-73.9496,2021-05-14 14:00:00
US,2021-05-14 14:48:10,0.0,"Atlanta, GA",Atlanta,city,0.0,眉ber is worth 78 billion and they want the average joe to donate free rides to other average joe so that they,0.0,1,Atlanta,GA,Georgia,Fulton,33.7627,-84.4224,2021-05-14 14:00:00
US,2021-05-14 14:47:43,1.0,"Bellerose Terrace, NY",Bellerose Terrace,city,0.0,only site where you can get the vaccine where you can also see rat scurrying by,0.0,1,Bellerose Terrace,NY,New York,Nassau,40.7221,-73.7252,2021-05-14 14:00:00
US,2021-05-14 14:47:33,0.0,"Palo Alto, CA",Palo Alto,city,0.0,children under 18 make up about quarter of the s population so if we want to get the virus under control and,0.0,1,Palo Alto,CA,California,Santa Clara,37.3913,-122.1468,2021-05-14 14:00:00
US,2021-05-14 14:47:08,16.0,"Evanston, IL",Evanston,city,7.0,a friendly reminder that we will be hosting vaccine clinics this weekend few updates kids 12 can get the vacci,0.0,1,Evanston,IL,Illinois,Cook,42.0463,-87.6942,2021-05-14 14:00:00
US,2021-05-14 14:46:50,1.0,"Manhattan, NY",Manhattan,city,0.0,come visit your vaccination site team at 1549 amsterdam ave at 138th ages 18 this site 12 at s,0.0,1,Manhattan,NY,New York,New York,40.7834,-73.9662,2021-05-14 14:00:00
US,2021-05-14 14:46:10,0.0,"Marina, CA",Marina,city,0.0,so is this new no mask for fully vaccinated people thing for us californians would ha,0.0,1,Marina,CA,California,Monterey,36.6812,-121.7895,2021-05-14 14:00:00
US,2021-05-14 14:45:59,0.0,"Oakland, CA",Oakland,city,0.0,how is it that the vaccine is only 94 effective at preventing hospitalizations in people 65 hospit,0.0,1,Oakland,CA,California,Alameda,37.7903,-122.2165,2021-05-14 14:00:00
US,2021-05-14 14:45:52,0.0,"The Woodlands, TX",The Woodlands,city,0.0,use the app that you can download onto your iphone to ding the chip imbedded in the vaccine duh,0.0,1,The Woodlands,TX,Texas,Montgomery,30.1738,-95.5134,2021-05-14 14:00:00
US,2021-05-14 14:45:28,0.0,"San Francisco, CA",San Francisco,city,0.0,hopefully this is one signal that our once every 100 year covid health crisis may be turning corner btw you,0.0,0,San Francisco,CA,California,San Francisco,37.7562,-122.443,2021-05-14 14:00:00
US,2021-05-14 14:45:26,0.0,"San Francisco, CA",San Francisco,city,1.0,assume this means progress in our fight against covid 19 if you were or are rider of the sf muni muni m,0.0,1,San Francisco,CA,California,San Francisco,37.7562,-122.443,2021-05-14 14:00:00
US,2021-05-14 14:44:51,0.0,"Wilmington Island, GA",Wilmington Island,city,0.0,i got put in twitter jail for sarcastically quoting trump moronic covid treatments,0.0,0,Wilmington Island,GA,Georgia,Chatham,32.0036,-80.9752,2021-05-14 14:00:00
US,2021-05-14 14:44:31,0.0,"San Francisco, CA",San Francisco,city,0.0,my local pharmacy has sign saying the covid vaccine is right around the corner and have no idea whether that,0.0,0,San Francisco,CA,California,San Francisco,37.7562,-122.443,2021-05-14 14:00:00
US,2021-05-14 14:44:30,1.0,"Ames, IA",Ames,city,0.0,i guessing slightly worse to be honest my back and neck are sort of fucked from covid lol,0.0,0,Ames,IA,Iowa,Story,42.0259,-93.6215,2021-05-14 14:00:00
US,2021-05-14 14:44:23,2.0,"Hamburg, NY",Hamburg,city,0.0,ironically the less often prescribed armenian vaccine is derived from manhattan base formula includ,0.0,1,,,,,,,2021-05-14 14:00:00
US,2021-05-14 14:43:50,1.0,"Odenton, MD",Odenton,city,0.0,we ve assumed this for some time but as reports in this article the actual data coming out of,0.0,1,Odenton,MD,Maryland,Anne Arundel,39.0661,-76.6939,2021-05-14 14:00:00
US,2021-05-14 14:43:25,4.0,"Denver, CO",Denver,city,0.0,has anyone had the moderna where shot one fucked you up so you were fine for shot two plz say yes,0.0,1,Denver,CO,Colorado,Denver,39.7621,-104.8759,2021-05-14 14:00:00
US,2021-05-14 14:43:01,0.0,"St Cloud, MN",St Cloud,city,0.0,interested in job in st cloud mn this could be great fit,1.0,1,,,,,,,2021-05-14 14:00:00
US,2021-05-14 14:43:00,6.0,"San Francisco, CA",San Francisco,city,0.0,me booking my trips after my second vaccine did have some difficulty with side effects but finally feeling bet,1.0,1,San Francisco,CA,California,San Francisco,37.7562,-122.443,2021-05-14 14:00:00
US,2021-05-14 14:42:50,0.0,"Bradford Woods, PA",Bradford Woods,city,0.0,scientist in the netherlands have trained bees to detect covid why bee,0.0,1,Bradford Woods,PA,Pennsylvania,Allegheny,40.6369,-80.0809,2021-05-14 14:00:00
US,2021-05-14 14:42:33,0.0,"Walnut Creek, CA",Walnut Creek,city,0.0,how is this any different than showing proof of the covid vaccine along with proof of other mandato,0.0,1,Walnut Creek,CA,California,Contra Costa,37.9024,-122.0398,2021-05-14 14:00:00
US,2021-05-14 14:42:02,0.0,"Trowbridge Park, MI",Trowbridge Park,city,0.0,what wonder is if it a calculated step towards the maligned vaccine passport in,0.0,1,Trowbridge Park,MI,Michigan,Marquette,46.5565,-87.4417,2021-05-14 14:00:00
US,2021-05-14 14:41:51,1.0,"Chicago, IL",Chicago,city,0.0,the exception might be for extremely highly vaccinated low covid prevalence areas g bay area but most of the,0.0,0,Chicago,IL,Illinois,Cook,41.8373,-87.6862,2021-05-14 14:00:00
US,2021-05-14 14:41:38,0.0,"Los Angeles, CA",Los Angeles,city,0.0,arguing that masks protect from colds and that masks are necessary to protect vaccinated people from covid,0.0,1,Los Angeles,CA,California,Los Angeles,34.1139,-118.4068,2021-05-14 14:00:00
US,2021-05-14 14:41:35,0.0,"Huntsville, AL",Huntsville,city,0.0,happy to get the second vaccine yesterday but damn does my left shoulder hurt the chills hit around mid,1.0,0,Huntsville,AL,Alabama,Madison,34.6988,-86.6412,2021-05-14 14:00:00
US,2021-05-14 14:41:20,2.0,"Las Vegas, NV",Las Vegas,city,1.0,our government passed 1 9 trillion covid relief bill using money we didnt have had to borrow distributed to stat,0.0,1,Las Vegas,NV,Nevada,Clark,36.2333,-115.2654,2021-05-14 14:00:00
US,2021-05-14 14:41:19,1.0,"Reston, VA",Reston,city,0.0,i sure they can give you something to demonstrate you got the vaccine eve,0.0,1,Reston,VA,Virginia,Fairfax,38.9497,-77.3461,2021-05-14 14:00:00
US,2021-05-14 14:41:15,0.0,"Modesto, CA",Modesto,city,0.0,exactly but there is nothing being done about obesity like they ve done for covid they re giving ou,0.0,1,Modesto,CA,California,Stanislaus,37.6374,-121.0028,2021-05-14 14:00:00
US,2021-05-14 14:41:11,1.0,"Shiloh, PA",Shiloh,city,0.0,i am so nervous for my second dose but ill take the risk of having it for 24 hours and being done then having covid real bad,0.0,0,Shiloh,PA,Pennsylvania,York,39.9734,-76.792,2021-05-14 14:00:00
US,2021-05-14 14:41:05,2.0,"Huntsville, AL",Huntsville,city,0.0,the whole covid cure is worse than the disease right now,0.0,0,Huntsville,AL,Alabama,Madison,34.6988,-86.6412,2021-05-14 14:00:00
US,2021-05-14 14:40:48,1.0,"Merritt Island, FL",Merritt Island,city,0.0,what in the actual this is so damn disturbing and horribly disgusting way to proceed with the vaccine incentiv,0.0,0,Merritt Island,FL,Florida,Brevard,28.3146,-80.6713,2021-05-14 14:00:00
US,2021-05-14 14:40:10,2.0,"Norman, OK",Norman,city,0.0,i guess just figure my 3 and 5 year old have way less chance now of getting it than before the vac,0.0,1,Norman,OK,Oklahoma,Cleveland,35.2335,-97.3471,2021-05-14 14:00:00
US,2021-05-14 14:40:07,7.0,"Miami, FL",Miami,city,1.0,three family members of mine have covid and they were fully vaccinated,0.0,1,Miami,FL,Florida,Miami-Dade,25.7839,-80.2102,2021-05-14 14:00:00
US,2021-05-14 14:39:54,2.0,"Marshfield, MA",Marshfield,city,2.0,how many times did stefanik utter president trump president trump president trump he remains leader o,0.0,1,,,,,,,2021-05-14 14:00:00
US,2021-05-14 14:39:52,0.0,"Frisco, TX",Frisco,city,0.0,and here the rest of wakeland pics from ap lit and now ism couldn get pics last year 2020 bc of covid and,0.0,1,Frisco,TX,Texas,Collin,33.1555,-96.8215,2021-05-14 14:00:00
US,2021-05-14 14:39:44,2.0,"Arvada, CO",Arvada,city,0.0,the way we ve been in this pandemic for over year and there are people acting like covid hasn taken peoples liv,0.0,1,Arvada,CO,Colorado,Jefferson,39.8321,-105.1511,2021-05-14 14:00:00
US,2021-05-14 14:39:12,0.0,"Modesto, CA",Modesto,city,0.0,i have no issue with anyone eating people should be able to do what they want my point was they d,0.0,0,Modesto,CA,California,Stanislaus,37.6374,-121.0028,2021-05-14 14:00:00
US,2021-05-14 14:39:11,10.0,"Richmond, KY",Richmond,city,0.0,the cdc recent announcement is another example of service industry workers being responsible for the bulk of covid 19 safety protocol,0.0,1,Richmond,KY,Kentucky,Madison,37.7306,-84.2926,2021-05-14 14:00:00
US,2021-05-14 14:39:08,0.0,"Mason, OH",Mason,city,0.0,mtg is an evil ugly bitch hope she gets covid,0.0,0,Mason,OH,Ohio,Warren,39.3571,-84.3023,2021-05-14 14:00:00
US,2021-05-14 14:38:37,3.0,"Agoura Hills, CA",Agoura Hills,city,0.0,normally yes because was conditioned to feel guilty for using my sick days in previous jobs b,0.0,0,Agoura Hills,CA,California,Los Angeles,34.151,-118.7608,2021-05-14 14:00:00
US,2021-05-14 14:38:33,2.0,"Queens, NY",Queens,city,0.0,so we have the choice now to wear mask or not if vaccinated in the us everyone is wearing their mask on the subw,0.0,1,Queens,NY,New York,Queens,40.7498,-73.7976,2021-05-14 14:00:00
US,2021-05-14 14:38:08,7.0,"Fayette, MO",Fayette,city,0.0,i don have the vaccine only bc it so new amp young woman have been having fertility issues after the shots do,0.0,1,Fayette,MO,Missouri,Howard,39.147,-92.6857,2021-05-14 14:00:00
US,2021-05-14 14:37:59,1.0,"Juneau, AK",Juneau,city,0.0,blasphemy doesn mean what you think it means as for the vaccine you do you but don expec,0.0,1,Juneau,AK,Alaska,Juneau,58.4546,-134.1739,2021-05-14 14:00:00
US,2021-05-14 14:37:41,6.0,"Nashville, TN",Nashville,city,1.0,starting today in nashville the board chair and the director of health and metro public health department epidemi,1.0,1,Nashville,TN,Tennessee,Davidson,36.1715,-86.7843,2021-05-14 14:00:00
US,2021-05-14 14:37:32,12.0,"Oakland, CA",Oakland,city,0.0,i on like day 12 of going at it on facebook with couple of rugby mates who are convinced vaccines are governm,0.0,1,Oakland,CA,California,Alameda,37.7903,-122.2165,2021-05-14 14:00:00
US,2021-05-14 14:37:31,0.0,"O'Fallon, IL",O'Fallon,city,0.0,outstanding,0.0,1,O'Fallon,IL,Illinois,St. Clair,38.5976,-89.9155,2021-05-14 14:00:00
US,2021-05-14 14:36:58,2.0,"Wyoming, MI",Wyoming,city,0.0,i also thinking of someone for whom the vaccine is less effective because of compr,0.0,1,Wyoming,MI,Michigan,Kent,42.8909,-85.7066,2021-05-14 14:00:00
US,2021-05-14 14:36:21,18.0,"Avon, MA",Avon,city,3.0,me at home depot so no more masks inside if yr vaccinated associate dunno but if that the case m gonna go get my vaccine,0.0,0,,,,,,,2021-05-14 14:00:00
US,2021-05-14 14:36:19,10.0,"Glen Burnie, MD",Glen Burnie,city,2.0,remember you may be vaccinated against covid 19 but you are not protected from all the other sicknesses we used to,0.0,0,Glen Burnie,MD,Maryland,Anne Arundel,39.1559,-76.6072,2021-05-14 14:00:00
US,2021-05-14 14:36:09,0.0,"Bradford Woods, PA",Bradford Woods,city,0.0,now that the pandemic rules have eased all those wonderful adopted puppies kittens that sheltered people got ar,0.0,1,Bradford Woods,PA,Pennsylvania,Allegheny,40.6369,-80.0809,2021-05-14 14:00:00
US,2021-05-14 14:34:47,0.0,"Bellevue, KY",Bellevue,city,0.0,had covid just got through cold myself with the vaccine but at least can get covid anymore hopefully,0.0,1,Bellevue,KY,Kentucky,Campbell,39.1011,-84.4776,2021-05-14 14:00:00
US,2021-05-14 14:34:18,0.0,"New Orleans, LA",New Orleans,city,0.0,deferred my tix from last year so m looking forward to packed dome honestly don care if people g,0.0,1,New Orleans,LA,Louisiana,Orleans,30.0687,-89.9288,2021-05-14 14:00:00
US,2021-05-14 14:34:16,1.0,"Grapevine, TX",Grapevine,city,0.0,every time the avs had covid pause it took few games for them to start rolling they are rolling,0.0,1,Grapevine,TX,Texas,Tarrant,32.9343,-97.0744,2021-05-14 14:00:00
US,2021-05-14 14:34:09,1.0,"Manhattan, NY",Manhattan,city,0.0,i don buy all this negative stuff coming out about rebekah jones think it an effort to sanitize,0.0,0,Manhattan,NY,New York,New York,40.7834,-73.9662,2021-05-14 14:00:00
US,2021-05-14 14:33:46,0.0,"Cypress, CA",Cypress,city,0.0,again no the responses actually point to how ridiculous the op was the undercurrent i,0.0,0,Cypress,CA,California,Orange,33.8171,-118.0386,2021-05-14 14:00:00
US,2021-05-14 14:33:39,2.0,"Cleveland, OH",Cleveland,city,0.0,it my newly acquired vaccine super powers,0.0,1,Cleveland,OH,Ohio,Cuyahoga,41.4767,-81.6804,2021-05-14 14:00:00
US,2021-05-14 14:33:39,0.0,"Las Vegas, NV",Las Vegas,city,0.0,not to be difficult but how can this be legal he taking taxpayers money funded under the covid relief bill mean,0.0,1,Las Vegas,NV,Nevada,Clark,36.2333,-115.2654,2021-05-14 14:00:00
US,2021-05-14 14:33:25,3.0,"Santa Clarita, CA",Santa Clarita,city,0.0,just cause you vaccinated doesn mean your in the clear,0.0,1,Santa Clarita,CA,California,Los Angeles,34.4175,-118.4964,2021-05-14 14:00:00
US,2021-05-14 14:33:24,1.0,"Pittsburgh, PA",Pittsburgh,city,0.0,yeah don think we are going to have mission accomplished banner moment for co,0.0,1,Pittsburgh,PA,Pennsylvania,Allegheny,40.4396,-79.9762,2021-05-14 14:00:00
US,2021-05-14 14:33:20,0.0,"Pasadena, CA",Pasadena,city,0.0,dead there supposedly chicken shortage supply chain problem guess the chicken sandwich wars con,0.0,0,Pasadena,CA,California,Los Angeles,34.1597,-118.139,2021-05-14 14:00:00
US,2021-05-14 14:33:14,0.0,"New Brunswick, NJ",New Brunswick,city,0.0,getting the first dose of the vaccine and m nervous haven gotten vaccine in over decade the heldrich,0.0,0,New Brunswick,NJ,New Jersey,Middlesex,40.487,-74.445,2021-05-14 14:00:00
US,2021-05-14 14:33:04,1.0,"Upper Darby, PA",Upper Darby,city,0.0,vaccine subscriptions for low monthly fee you too can have lifetime protection it coming,0.0,0,,,,,,,2021-05-14 14:00:00
US,2021-05-14 14:32:41,0.0,"Greenfield, WI",Greenfield,city,0.0,why get the vaccine if nothing changes did you think people were going to wear masks forever read the room,0.0,1,Greenfield,WI,Wisconsin,Milwaukee,42.9619,-88.0051,2021-05-14 14:00:00
US,2021-05-14 14:32:39,7.0,"Philadelphia, PA",Philadelphia,city,2.0,this is what most people watching the transportation situation are expecting to happen this is situation where p,0.0,1,Philadelphia,PA,Pennsylvania,Philadelphia,40.0077,-75.1339,2021-05-14 14:00:00
US,2021-05-14 14:32:21,0.0,"Arlington, VA",Arlington,city,0.0,self care practices to help beat covid 19 anxiety and depression via,0.0,1,Arlington,VA,Virginia,Arlington,38.8786,-77.1011,2021-05-14 14:00:00
US,2021-05-14 14:32:07,3.0,"Edina, MN",Edina,city,0.0,covid vaccines today at valley view,0.0,1,Edina,MN,Minnesota,Hennepin,44.8914,-93.3602,2021-05-14 14:00:00
US,2021-05-14 14:31:58,3.0,"Brooklyn, NY",Brooklyn,city,0.0,,0.0,1,Brooklyn,NY,New York,Kings,40.6501,-73.9496,2021-05-14 14:00:00
US,2021-05-14 14:31:56,2.0,"Joplin, MO",Joplin,city,0.0,evergreen and it has nothing to do with covid,0.0,1,Joplin,MO,Missouri,Jasper,37.0758,-94.5018,2021-05-14 14:00:00
US,2021-05-14 14:31:53,0.0,"Norman, OK",Norman,city,0.0,my students are 2 3 years old and we ve had few of them and their families infected lots of peo,0.0,0,Norman,OK,Oklahoma,Cleveland,35.2335,-97.3471,2021-05-14 14:00:00
US,2021-05-14 14:31:14,0.0,"Washington, DC",Washington,city,0.0,so here my thing if cole is the rapper some y all say he is this album should be reflection on the past,0.0,1,Washington,DC,District of Columbia,District of Columbia,38.9047,-77.0163,2021-05-14 14:00:00
US,2021-05-14 14:30:42,1.0,"Sacramento, CA",Sacramento,city,0.0,these vaccine symptoms ain it,0.0,1,Sacramento,CA,California,Sacramento,38.5667,-121.4683,2021-05-14 14:00:00
US,2021-05-14 14:30:11,3.0,"Topeka, KS",Topeka,city,0.0,ooh forgot how we were supposed to be covid warriors,0.0,1,Topeka,KS,Kansas,Shawnee,39.0346,-95.6955,2021-05-14 14:00:00
US,2021-05-14 14:29:45,0.0,"Montgomery, AL",Montgomery,city,0.0,magic city apartment boom reignites once sleepy birmingham industry via,0.0,1,Montgomery,AL,Alabama,Montgomery,32.3473,-86.2666,2021-05-14 14:00:00
US,2021-05-14 14:29:23,0.0,"Williamsport, PA",Williamsport,city,0.0,tommy sweeney te comes to mind,0.0,1,Williamsport,PA,Pennsylvania,Lycoming,41.2398,-77.0371,2021-05-14 14:00:00
US,2021-05-14 14:28:55,0.0,"Cypress, CA",Cypress,city,0.0,again even the priests tweet is pointless lying is sin period end of sentence w,0.0,0,Cypress,CA,California,Orange,33.8171,-118.0386,2021-05-14 14:00:00
US,2021-05-14 14:28:54,0.0,"San Francisco, CA",San Francisco,city,0.0,um there wasn a vaccine when tom hanks got covid,0.0,1,San Francisco,CA,California,San Francisco,37.7562,-122.443,2021-05-14 14:00:00
US,2021-05-14 14:28:36,0.0,"Wyandotte, MI",Wyandotte,city,0.0,yes we can still get covid but we re lot less likely to get hospitalized that was the point of this to build her,0.0,1,Wyandotte,MI,Michigan,Wayne,42.2113,-83.1558,2021-05-14 14:00:00
US,2021-05-14 14:28:35,0.0,"St Louis, MO",St Louis,city,0.0,post covid my wardrobe is in two parts digital display and out of home,0.0,1,,,,,,,2021-05-14 14:00:00
US,2021-05-14 14:28:34,0.0,"Twin Falls, ID",Twin Falls,city,0.0,accused covid relief fraudster belongs to extremist group feds say,0.0,0,Twin Falls,ID,Idaho,Twin Falls,42.5645,-114.4615,2021-05-14 14:00:00
US,2021-05-14 14:27:41,1.0,"Miami, FL",Miami,city,0.0,tell that to three family members who are vaccinated and have covid,0.0,1,Miami,FL,Florida,Miami-Dade,25.7839,-80.2102,2021-05-14 14:00:00
US,2021-05-14 14:27:23,7.0,"Brenham, TX",Brenham,city,1.0,it game day san jac south campus 7 30pm approx coastal bend alvin website br,0.0,1,Brenham,TX,Texas,Washington,30.1585,-96.3964,2021-05-14 14:00:00
US,2021-05-14 14:25:54,1.0,"Hazard, KY",Hazard,city,0.0,i ll be on the air soon with mountain news special report on as gives covid 19 update,1.0,1,Hazard,KY,Kentucky,Perry,37.2583,-83.1977,2021-05-14 14:00:00
US,2021-05-14 14:25:26,1.0,"Altamonte Springs, FL",Altamonte Springs,city,0.0,did anyone bruise after their second pfizer shot it been two weeks and still have bruise,0.0,1,Altamonte Springs,FL,Florida,Seminole,28.6615,-81.3953,2021-05-14 14:00:00
US,2021-05-14 14:24:47,0.0,"Chicago, IL",Chicago,city,0.0,i take the contrary view if the vaccine has 96 ethicacy and on top of that letting me do what i,0.0,1,Chicago,IL,Illinois,Cook,41.8373,-87.6862,2021-05-14 14:00:00
US,2021-05-14 14:24:31,1.0,"Affton, MO",Affton,city,0.0,323australia 2 22w q22q never ending travel ban,0.0,1,Affton,MO,Missouri,St. Louis,38.5499,-90.3264,2021-05-14 14:00:00
US,2021-05-14 14:24:21,5.0,"Brooklyn, NY",Brooklyn,city,2.0,isn the primary effect of the vaccine mitigation of symptoms rather than reduction of transmission the mask wea,0.0,1,Brooklyn,NY,New York,Kings,40.6501,-73.9496,2021-05-14 14:00:00
US,2021-05-14 14:24:16,2.0,"Brooklyn, NY",Brooklyn,city,0.0,japan mishandling of the pandemic is amazing they re so focused on the olympics but encouraged travel to hokkai,1.0,1,Brooklyn,NY,New York,Kings,40.6501,-73.9496,2021-05-14 14:00:00
US,2021-05-14 14:23:32,8.0,"Green Bay, WI",Green Bay,city,0.0,we re to the point where they could market the vaccine as if you get it you will get laid and it not even that far off,0.0,1,Green Bay,WI,Wisconsin,Brown,44.515,-87.9896,2021-05-14 14:00:00
US,2021-05-14 14:23:30,3.0,"Rutland, VT",Rutland,city,0.0,the pneumonia vaccine got in december 2019 saved me from the respiratory distress of the 30 days j,0.0,0,Rutland,VT,Vermont,Rutland,43.6091,-72.9782,2021-05-14 14:00:00
US,2021-05-14 14:23:02,0.0,"Nashville, TN",Nashville,city,0.0,clay 600 thousand americans are dead of covid know you make money off of sexist and racist but isn t,0.0,0,Nashville,TN,Tennessee,Davidson,36.1715,-86.7843,2021-05-14 14:00:00
US,2021-05-14 14:22:58,4.0,"Nashua, NH",Nashua,city,0.0,,0.0,1,Nashua,NH,New Hampshire,Hillsborough,42.7491,-71.491,2021-05-14 14:00:00
US,2021-05-14 14:22:58,0.0,"Alma, MI",Alma,city,1.0,i got mega ratio don care get your damned vaccine,0.0,1,Alma,MI,Michigan,Gratiot,43.38,-84.6556,2021-05-14 14:00:00
US,2021-05-14 14:22:45,0.0,"Irvine, CA",Irvine,city,0.0,just 12 people are behind most vaccine hoaxes on social media research shows,0.0,1,Irvine,CA,California,Orange,33.6772,-117.7738,2021-05-14 14:00:00
US,2021-05-14 14:22:30,6.0,"Chicago, IL",Chicago,city,1.0,the cdc also just tweeted that if you eat white castle you don have to get the vaccine,0.0,1,Chicago,IL,Illinois,Cook,41.8373,-87.6862,2021-05-14 14:00:00
US,2021-05-14 14:22:14,0.0,"San Antonio, TX",San Antonio,city,0.0,be sure to thank the orange one for your vaccine,0.0,1,San Antonio,TX,Texas,Bexar,29.4658,-98.5253,2021-05-14 14:00:00
US,2021-05-14 14:21:49,2.0,"Forest Lake, MN",Forest Lake,city,0.0,i love how people cry about their arm hurting or headache with their vaccine bitch get covid and then come talk,0.0,0,Forest Lake,MN,Minnesota,Washington,45.2536,-92.9583,2021-05-14 14:00:00
US,2021-05-14 14:21:16,0.0,"Washington, DC",Washington,city,0.0,who of the vaxxed population would go without mask how can you trust anyone inside grocery store crowded ca,0.0,1,Washington,DC,District of Columbia,District of Columbia,38.9047,-77.0163,2021-05-14 14:00:00
US,2021-05-14 14:21:12,1.0,"Bixby, OK",Bixby,city,0.0,i know this might be hard to believe but more discoveries,0.0,0,Bixby,OK,Oklahoma,Tulsa,35.9454,-95.8773,2021-05-14 14:00:00
US,2021-05-14 14:21:02,1.0,"Reno, NV",Reno,city,0.0,i got my 2 moderna vax the 2nd last fri the 1st one was little rough not too bad,0.0,1,Reno,NV,Nevada,Washoe,39.5497,-119.8483,2021-05-14 14:00:00
US,2021-05-14 14:20:43,1.0,"Corona, CA",Corona,city,1.0,nyy ss gleyber torres just tested positive for covid after being fully vaccinated and having covid last summer 7 o,0.0,1,Corona,CA,California,Riverside,33.8616,-117.5649,2021-05-14 14:00:00
US,2021-05-14 14:20:33,0.0,"Manhattan, NY",Manhattan,city,0.0,it discouraging news but no one ever said you wouldn get covid with the vaccine but it does mean if you re vacc,0.0,0,Manhattan,NY,New York,New York,40.7834,-73.9662,2021-05-14 14:00:00
US,2021-05-14 14:20:20,1.0,"Fountain Hills, AZ",Fountain Hills,city,0.0,then covid 19 outbreak,0.0,1,Fountain Hills,AZ,Arizona,Maricopa,33.6073,-111.7398,2021-05-14 14:00:00
US,2021-05-14 14:20:07,1.0,"Seattle, WA",Seattle,city,0.0,totally suicide and murder by covid is huge thing m done with y,0.0,0,Seattle,WA,Washington,King,47.6211,-122.3244,2021-05-14 14:00:00
US,2021-05-14 14:19:40,0.0,"Cudahy, CA",Cudahy,city,0.0,not getting vaccinated when there a vaccine and your age makes you amongst the first in line speaks volume s,0.0,1,Cudahy,CA,California,Los Angeles,33.9631,-118.183,2021-05-14 14:00:00
US,2021-05-14 14:19:39,2.0,"Overland Park, KS",Overland Park,city,2.0,researchers have found just 12 people are responsible for the bulk of the misleading claims and outright lies about,0.0,0,Overland Park,KS,Kansas,Johnson,38.887,-94.687,2021-05-14 14:00:00
US,2021-05-14 14:19:31,2.0,"Portland, OR",Portland,city,0.0,why aren you getting the vaccine don know just don want to he just wanted to piss people off,0.0,0,Portland,OR,Oregon,Multnomah,45.5372,-122.65,2021-05-14 14:00:00
US,2021-05-14 14:17:46,2.0,"Bellevue, WA",Bellevue,city,0.0,i don normally but yeah pfizer no side effects nobody with amp i like the mask,0.0,1,Bellevue,WA,Washington,King,47.5951,-122.1535,2021-05-14 14:00:00
US,2021-05-14 14:16:40,14.0,"Maryland Heights, MO",Maryland Heights,city,1.0,re not wearing masks if you ve been vaccinated liberals really need to relax the cdc is telling us scientific f,0.0,1,Maryland Heights,MO,Missouri,St. Louis,38.7189,-90.4749,2021-05-14 14:00:00
US,2021-05-14 14:16:33,0.0,"Finneytown, OH",Finneytown,city,0.0,cvs health is hiring in cincinnati oh click the link in our bio to apply covid 19 vaccine support pharmacy tec,0.0,1,Finneytown,OH,Ohio,Hamilton,39.2159,-84.5145,2021-05-14 14:00:00
US,2021-05-14 14:16:24,1.0,"Philadelphia, PA",Philadelphia,city,0.0,yeah once my second vaccine kicks in m happy to spend time with people know are vaxxed but just c,0.0,1,Philadelphia,PA,Pennsylvania,Philadelphia,40.0077,-75.1339,2021-05-14 14:00:00
